{
  "fileName": "archive.dat",
  "format": "DAT (Metadata)",
  "totalRecords": 200,
  "properties": {
    "encoding": "UTF-8",
    "lineEnding": "CRLF",
    "delimiters": {
      "column": "ascii:20",
      "quote": "ascii:254",
      "newline": "ascii:174",
      "multiValue": "char:;",
      "nestedValue": "char:\\"
    }
  },
  "chaosMode": {
    "enabled": false,
    "totalAnomalies": 0
  }
}